Title,Situation,Question,Ideal Response
Facing Fear of Failure,"An individual is paralyzed by the fear of failing, preventing them from taking risks or trying new things.",I'm so scared of failing that I avoid trying anything new or challenging. How can I overcome this fear?,"Fear of failure can be a significant barrier. It's important to recognize that failure is a natural part of growth and learning. Setting small, achievable goals and gradually challenging yourself can help build confidence. A clinician can provide support and strategies to address this fear effectively."
Struggling with Low Self-Esteem,"An individual has persistent feelings of inadequacy and low self-worth, affecting their interactions and opportunities.","I always feel like I'm not good enough, no matter what I do. How can I improve my self-esteem?","Building self-esteem can be a gradual process. It involves recognizing your intrinsic worth, challenging negative thoughts about yourself, and practicing self-compassion. Therapy can be a safe space to explore these feelings and develop a more positive self-view."
Dealing with Anger Management Issues,"An individual frequently experiences intense anger outbursts, regretting their actions afterward and seeking ways to manage their anger.",I lose my temper quickly and have outbursts that I later regret. How can I manage my anger better?,"Managing anger is important for your well-being and relationships. Techniques such as deep breathing, pausing before reacting, and expressing feelings in a non-confrontational way can help. Consider seeking help from a clinician who can provide strategies to manage anger in a healthy manner."
Navigating Life After Incarceration,An individual recently released from incarceration is facing challenges in re-adjusting to society and dealing with stigma.,I'm finding it hard to adjust to life after being in prison. How can I cope with the stigma and rebuild my life?,"Re-entering society after incarceration can be challenging. It's important to seek support systems, including community programs designed for individuals in your situation. Therapy can also provide a space to work through emotions and plan for a positive future."
Struggling with Seasonal Affective Disorder,"An individual experiences depression and lethargy during the winter months, suspecting they might have Seasonal Affective Disorder (SAD).","Every winter, I feel depressed and lack energy. Could this be Seasonal Affective Disorder, and what can I do about it?","What you're describing does sound like Seasonal Affective Disorder (SAD), which is not uncommon. Treatments like light therapy, medication, and psychotherapy can be effective. It's important to discuss these symptoms with a clinician to find the best treatment for you."
Addressing Chronic Procrastination,"An individual continually procrastinates, leading to stress and a feeling of being stuck.","I always put things off until the last minute, and it's causing me stress. How can I stop procrastinating?","Procrastination can be a challenging habit to break. It often helps to break tasks into smaller, manageable steps and to set clear deadlines. Understanding the underlying reasons for your procrastination can also be key. A clinician can help you explore these reasons and develop strategies to overcome procrastination."
Coping with Life After Major Surgery,An individual is recovering from major surgery and struggling with the physical and emotional impact of the recovery process.,I had major surgery and feel overwhelmed with the recovery process. How can I cope with this?,"Recovering from major surgery can be challenging both physically and emotionally. It's important to give yourself time to heal and to seek support from clinicians, friends, and family. Engaging in gentle activities and therapy can also support your emotional well-being during this time."
Facing Challenges of New Parenthood,New parents are feeling overwhelmed by the responsibilities and changes that come with caring for a newborn.,"As a new parent, I feel so overwhelmed and anxious about everything. Is this normal, and what can I do?","Becoming a new parent is a huge life change, and it's normal to feel overwhelmed. Remember, you're not alone, and it's okay to ask for help. Connecting with other parents, joining support groups, or speaking with a clinician can provide support and reassurance."
Overcoming Test Anxiety,"A student experiences debilitating anxiety before exams, impacting their performance and overall well-being.",I get so anxious before tests that I can't perform as well as I know I can. What can I do to manage this anxiety?,"Test anxiety is quite common and can be managed. Techniques like deep breathing, positive visualization, and systematic desensitization can be helpful. It might also be beneficial to discuss these feelings with a clinician who can provide additional coping strategies and support."
Managing Grief from Pet Loss,"An individual is struggling with intense grief after the loss of a beloved pet, feeling a significant impact on their daily life.","I lost my pet who was with me for years, and I can't seem to get past the sadness. How can I cope with this loss?",Losing a pet can be a deeply painful experience as they are cherished members of our families. Allow yourself time to grieve and remember the joy your pet brought into your life. It can be helpful to create a tribute or find a support group to share your feelings with others who understand.
Combating Chronic Insomnia,"An individual has been suffering from chronic insomnia, leading to fatigue, irritability, and difficulty concentrating during the day.",I have trouble sleeping almost every night and it's affecting my whole life. What can I do to improve my sleep?,"Chronic insomnia can be challenging, but there are effective treatments available. Maintaining a regular sleep schedule, creating a comfortable sleep environment, limiting caffeine use, and avoiding screens before bedtime can help. It's also important to consult with a clinician to explore other treatment options."
Dealing with Disordered Eating,"An individual is experiencing disordered eating behaviors, including restrictive dieting and an unhealthy preoccupation with body image.","I'm constantly worried about my weight and what I eat. I know it's not healthy, but I can't stop. What should I do?",Concerns about weight and food can develop into disordered eating patterns. It's important to seek help from clinicians who specialize in eating disorders. They can provide the necessary support and treatment to help you develop a healthier relationship with food and your body.
Addressing Relationship Jealousy,"An individual feels overwhelming jealousy in their relationship, leading to constant anxiety and strain on the partnership.","I feel jealous all the time in my relationship, and it's causing so much stress. How can I deal with these feelings?","Feeling jealousy in a relationship can be distressing. It's important to communicate openly with your partner about your feelings. Understanding the root of your jealousy and addressing it, possibly with the help of a clinician, can improve your relationship and well-being."
Coping with Midlife Crisis,"An individual in their midlife feels a sense of stagnation and disillusionment with life's achievements, questioning past decisions and the future.","I'm in my mid-40s and suddenly questioning everything in my life. Is this a midlife crisis, and what can I do about it?","Feeling a sense of questioning or crisis in midlife is not uncommon. It's an opportunity for reflection and growth. Consider exploring new interests, setting new goals, and possibly discussing your feelings with a clinician who can offer guidance and support."
Tackling Fear of Intimacy,"An individual feels scared of getting close to others and forming intimate relationships, leading to loneliness and isolation.",I'm scared of getting close to anyone and end up pushing people away. How can I overcome this fear of intimacy?,"Fear of intimacy can stem from various underlying issues. It's important to understand these fears and work through them, often with the help of a clinician. Building trust and emotional safety within relationships can be a gradual but rewarding process."
Handling Post-Adoption Challenges,An individual who recently adopted a child is facing challenges in bonding and dealing with the child's emotional and behavioral issues.,"I recently adopted a child, and we're struggling to bond and deal with some emotional issues. How can we navigate this?",Adopting a child is a significant change for both the child and parents. It's important to be patient and seek support from clinicians experienced in post-adoption challenges. Family therapy can also provide a space to build stronger bonds and address any emotional or behavioral concerns.
Struggling with the Aging Process,"An individual is struggling to accept the physical and social changes that come with aging, feeling a sense of loss and fear.",I'm having a hard time dealing with getting older and all the changes that come with it. How can I cope with this?,"The aging process can bring about many changes and it's natural to have mixed emotions about it. Focusing on what you can control, like maintaining a healthy lifestyle and staying socially active, can be empowering. It may also be helpful to speak with a clinician to navigate these feelings."
Dealing with Excessive Perfectionism in Children,"A parent is concerned about their child's excessive perfectionism, leading to stress and avoidance of challenges.",My child puts so much pressure on themselves to be perfect that it's causing them stress. How can I help them?,"Excessive perfectionism in children can be concerning. It's important to encourage a growth mindset, emphasizing learning and effort over perfection. Providing reassurance, setting realistic expectations, and seeking support from someone who specializes in working with children can also be beneficial."
Easing Transition to College Life,"A freshman in college is struggling with homesickness, academic pressure, and social challenges, feeling overwhelmed and isolated.","I'm a freshman in college and everything feels so overwhelming. I'm homesick, stressed about classes, and finding it hard to make friends. What can I do?","Transitioning to college can be challenging. It's important to give yourself time to adjust. Seek out campus resources like counseling services or student groups. Building a routine and setting aside time for self-care can also be beneficial. Remember, many students experience these feelings, and support is available."
Managing Anxiety Symptoms,"An individual has been experiencing increased levels of stress and anxiety due to recent job demands and personal challenges. They report feeling constantly overwhelmed, with a racing heart, difficulty concentrating, and trouble sleeping. Despite attempts at self-management, these symptoms persist, affecting their daily functioning and well-being.",Can you help me understand what I should do when I'm feeling extremely anxious and overwhelmed?,"As a mental healthcare chatbot, I'm designed to provide you with immediate coping strategies, such as deep breathing exercises and mindfulness techniques, which may help alleviate your anxiety. However, it's important to know that I'm not a substitute for professional medical advice. If you're frequently feeling overwhelmed, it's crucial to consult a healthcare provider for a comprehensive assessment and personalized treatment plan. For immediate crisis situations, please contact emergency services or the Suicide and Crisis Lifeline at 988."
Overcoming Fear of Public Transport,"An individual develops an irrational fear of using public transport, possibly due to a past negative experience, leading to avoidance and inconvenience.","I've become scared of using public transport, even though I know it's irrational. It's starting to really affect my daily life. How can I overcome this fear?","Fears related to specific situations like public transport can be quite limiting. Gradual exposure, along with relaxation techniques and cognitive-behavioral therapy, can be very effective. Consulting a clinician can provide you with tailored strategies to face and overcome this fear."
Dealing with Postpartum Anxiety,"A new mother is experiencing intense anxiety about her baby's health and well-being, impacting her ability to enjoy motherhood.","Since my baby was born, I can't stop worrying about their health and safety. It's overwhelming and I don't feel like I'm enjoying motherhood. What should I do?","Experiencing anxiety after the birth of a child is common and can be managed. It's important to speak openly about your feelings with clinicians and possibly a clinician. They can offer support and strategies to manage your anxiety. Also, connecting with other new parents can provide reassurance and a sense of community. If you are feeling suicidal or in crisis, please dial or text 988 (Suicide and Crisis Lifeline) or go to your nearest emergency room right away if your clinician is not available."
